{"$schema":"http://json-schema.org/draft-07/schema#","$id":"https://agentic-website-studio.local/schemas/human-expansion-playtest-gate.schema.json","type":"object","required":["schemaVersion","gateId","status","bindings","preview","supportBoundary","humanEvaluation","availableHumanActions"],"properties":{"schemaVersion":{"const":"1.0.0"},"gateId":{"const":"expansion_playtest_gate_wayfinder_m43_full_01"},"projectId":{"type":"string"},"selectedConceptId":{"type":"string"},"status":{"const":"pending_human_expansion_playtest"},"bindings":{"type":"object"},"preview":{"type":"object"},"supportBoundary":{"type":"object"},"automatedQaEstablished":{"type":"array"},"knownWarnings":{"type":"array"},"humanEvaluation":{"type":"array","minItems":14,"maxItems":14},"availableHumanActions":{"type":"array","minItems":3,"maxItems":3}}}
